{
  "execute_on": "ve",
  "name": "Upgrade LXC",
  "description": "Upgrades an existing LXC container in-place using a new OCI image. Stops the container, backs up its config, destroys and recreates it with the new rootfs at the same VMID (preserving all settings), then starts it again.\n\nFlow:\n- 011: Download OCI image and import to Proxmox storage (run separately before this template)\n- 221: Validate container and extract installed addons\n- 231: Stop, backup, destroy, recreate, merge config, start (includes readiness wait)",
  "parameters": [
    {
      "id": "oci_image",
      "name": "OCI Image",
      "type": "string",
      "required": true,
      "description": "OCI image reference used to upgrade the container (from 011-get-oci-image.json)."
    },
    {
      "id": "template_path",
      "name": "Template Path",
      "type": "string",
      "required": true,
      "description": "Path to the downloaded OCI template (from 011-get-oci-image.json)."
    },
    {
      "id": "ostype",
      "name": "OS Type",
      "type": "string",
      "default": "",
      "advanced": true,
      "description": "Optional OS type from the downloaded OCI image (from 011-get-oci-image.json)."
    },
    {
      "id": "source_vm_id",
      "name": "Container VM ID",
      "type": "number",
      "required": true,
      "description": "LXC container ID to upgrade in-place. Must be an oci-lxc-deployer managed container."
    }
  ],
  "commands": [
    {
      "name": "Validate & Prepare",
      "script": "upgrade-oci-lxc.sh",
      "library": "upgrade-common.sh",
      "outputs": ["vm_id"]
    },
    {
      "name": "Upgrade LXC",
      "template": "231-upgrade-start.json"
    }
  ]
}
