{
  "execute_on": "ve",
  "name": "Show Admin Credentials",
  "description": "Print the Zitadel admin loginname + password prominently in the deploy output. This is the only place a human sees the literal '!Aa1' suffix explained — it's appended to the stack-provided password by the docker-compose template to satisfy Zitadel's password complexity policy.",
  "parameters": [
    {
      "id": "ZITADEL_EXTERNALDOMAIN",
      "name": "Zitadel External Domain",
      "type": "string",
      "required": true,
      "description": "Public FQDN Zitadel is exposed under"
    },
    {
      "id": "ZITADEL_ADMIN_PASSWORD",
      "name": "Zitadel Admin Password",
      "type": "string",
      "internal": true,
      "description": "Raw password value from the oidc stack (suffix is added at print time)"
    }
  ],
  "commands": [
    {
      "name": "Show Admin Credentials",
      "script": "post-show-admin-credentials.sh"
    }
  ]
}
