{
  "execute_on": "lxc",
  "name": "Install Packages",
  "description": "Install packages inside the LXC container. Supports both Alpine Linux (apk) and Debian/Ubuntu (apt) package managers. Includes automatic network readiness check with retry logic. Runs if either packages or addon_packages is set.",
  "skip_if_all_missing": ["packages", "addon_packages"],
  "parameters": [
    {
      "id": "packages",
      "name": "Packages",
      "type": "string",
      "description": "Space-separated list of packages to install. For Alpine Linux, use APK package names. For Debian/Ubuntu, use apt package names."
    },
    {
      "id": "addon_packages",
      "name": "Addon Packages",
      "type": "string",
      "description": "Additional packages from addons (merged with base packages).",
      "advanced": true
    }
  ],
  "commands": [
    {
      "script": "post-install-apk-package.sh",
      "library": "pkg-common.sh",
      "description": "Install packages using the appropriate package manager (apk for Alpine, apt for Debian/Ubuntu)"
    }
  ]
}
