{
  "execute_on": "ve",
  "name": "Get OCI Image",
  "description": "Download OCI image from Docker Registry and import to Proxmox storage",
  "skip_if_property_set": "template_path",
  "parameters": [
    {
      "id": "oci_image",
      "name": "OCI Image",
      "type": "string",
      "required": true,
      "description": "OCI image reference (e.g., docker://alpine:latest, docker://debian:bookworm, oci://ghcr.io/owner/repo:latest)"
    },
    {
      "id": "oci_image_tag",
      "name": "Version",
      "type": "string",
      "required": true,
      "description": "OCI image tag / version to pull (e.g. '0.5.28', 'v4.12.3'). Explicit versions keep registry-mirror caches deterministic and make tests reproducible. Apps typically template this into their `oci_image` property (e.g. `ghcr.io/foo/bar:{{oci_image_tag}}`). Reconfigure does not execute this template, so the reconfigure path inherits the tag already stored in the container's notes."
    },
    {
      "id": "storage",
      "name": "Storage",
      "type": "string",
      "default": "local",
      "description": "Proxmox storage where the OCI image should be stored",
      "advanced": true
    },
    {
      "id": "registry_username",
      "name": "Registry Username",
      "type": "string",
      "description": "Username for registry authentication (optional, required for private images)",
      "advanced": true
    },
    {
      "id": "registry_password",
      "name": "Registry Password",
      "type": "string",
      "description": "Password for registry authentication (optional, required for private images)",
      "advanced": true
    },
    {
      "id": "registry_token",
      "name": "Registry Token",
      "type": "string",
      "description": "Bearer token for registry authentication (optional, alternative to username/password)",
      "advanced": true
    },
    {
      "id": "platform",
      "name": "Platform",
      "type": "string",
      "description": "Target platform (e.g., linux/amd64, linux/arm64). Auto-detects if not specified.",
      "advanced": true
    },
    {
      "id": "target_versions",
      "name": "Target Versions",
      "type": "string",
      "required": false,
      "description": "Comma-separated service=version pairs. For OCI-image apps: main=version to pull a specific tag."
    },
    {
      "id": "deployer_base_url",
      "name": "Deployer URL",
      "type": "string",
      "advanced": true,
      "description": "Auto-injected by backend: deployer base URL for CA certificate download"
    },
    {
      "id": "ve_context_key",
      "name": "VE Context",
      "type": "string",
      "advanced": true,
      "description": "Auto-injected by backend: VE context key for CA certificate download"
    }
  ],
  "commands": [
    {
      "name": "Get OCI Image",
      "script": "host-get-oci-image.py",
      "library": "oci_version_lib.py",
      "outputs": [
        "template_path",
        "ostype",
        "arch",
        "application_id",
        "application_name",
        "oci_image",
        "oci_image_tag"
      ]
    }
  ]
}